id,first_name,last_name,latitute,longitude,words
186,Retha,Meneo,41.4230192,20.2030313,tincidunt ante vel ipsum praesent blandit lacinia erat vestibulum sed magna at nunc commodo placerat praesent blandit nam nulla integer
187,Violet,Gooble,7.3775355,3.9470396,eu nibh quisque id justo sit amet sapien dignissim vestibulum vestibulum ante ipsum primis in faucibus orci luctus et
188,Gordon,Thunder,49.6522215,23.486531,pede malesuada in imperdiet et commodo vulputate justo in blandit ultrices enim lorem ipsum
189,Jayme,Boggish,31.396843,34.365268,posuere felis sed lacus morbi sem mauris laoreet ut rhoncus aliquet pulvinar sed nisl nunc
190,Phip,Geach,-6.7076379,111.3709499,ligula vehicula consequat morbi a ipsum integer a nibh in quis justo maecenas rhoncus aliquam lacus morbi
191,Brinna,O' Sullivan,34.527114,108.842622,eget massa tempor convallis nulla neque libero convallis eget eleifend luctus ultricies eu nibh quisque id justo sit amet sapien
192,Beulah,Lemarie,25.234479,110.179953,vel augue vestibulum ante ipsum primis in faucibus orci luctus et ultrices
193,Ana,Stellin,-31.3266229,-64.2603216,molestie lorem quisque ut erat curabitur gravida nisi at nibh in hac habitasse platea dictumst
194,Godart,Willatt,-7.31054,107.77903,sed justo pellentesque viverra pede ac diam cras pellentesque volutpat dui maecenas tristique est et tempus semper
195,Urbain,MacLoughlin,27.948308,109.599191,porta volutpat erat quisque erat eros viverra eget congue eget semper rutrum nulla
196,Berna,Garnsworth,47.692143,34.0079801,commodo vulputate justo in blandit ultrices enim lorem ipsum dolor sit amet consectetuer adipiscing elit
197,Jecho,Jerg,30.509648,113.084237,imperdiet sapien urna pretium nisl ut volutpat sapien arcu sed augue aliquam erat volutpat in congue etiam
198,Nonnah,Jossel,-8.081766,-78.0883695,sapien cursus vestibulum proin eu mi nulla ac enim in tempor turpis nec euismod scelerisque quam turpis adipiscing lorem
199,Marleah,Wormleighton,14.7790314,-16.9638997,libero nam dui proin leo odio porttitor id consequat in consequat
200,Maryjane,Biagi,34.8061587,70.9784562,aenean fermentum donec ut mauris eget massa tempor convallis nulla neque libero convallis eget eleifend luctus ultricies
201,Hynda,Grotty,48.8959487,2.2679278,ac enim in tempor turpis nec euismod scelerisque quam turpis adipiscing lorem vitae mattis nibh
202,Drew,Dealey,-9.9423239,124.3865392,arcu adipiscing molestie hendrerit at vulputate vitae nisl aenean lectus
203,Fancy,Haney,-2.2161048,113.913977,penatibus et magnis dis parturient montes nascetur ridiculus mus vivamus vestibulum sagittis sapien
204,Pierrette,Akam,36.681449,69.1149051,id nulla ultrices aliquet maecenas leo odio condimentum id luctus nec
205,Felizio,McDonagh,2.3629945,34.2421597,porta volutpat erat quisque erat eros viverra eget congue eget semper rutrum nulla nunc purus phasellus in
206,Everard,Orpyne,51.7565958,20.9183286,consequat in consequat ut nulla sed accumsan felis ut at dolor quis
207,Pascal,Parsonage,8.9721547,37.8618422,cursus id turpis integer aliquet massa id lobortis convallis tortor risus dapibus augue vel accumsan tellus nisi
208,Jacintha,Corryer,26.7297141,86.4794359,tincidunt nulla mollis molestie lorem quisque ut erat curabitur gravida nisi at nibh in hac habitasse platea dictumst aliquam
209,Lotte,MacCartan,49.5234905,14.4280868,est et tempus semper est quam pharetra magna ac consequat metus sapien ut nunc vestibulum ante ipsum primis in
210,Felic,MacDonogh,43.5757545,21.331051,gravida sem praesent id massa id nisl venenatis lacinia aenean sit amet justo morbi
211,Hetti,Mahood,-3.7436735,-73.2516326,at nulla suspendisse potenti cras in purus eu magna vulputate
212,Kelci,Eaklee,30.847047,116.363101,pretium iaculis justo in hac habitasse platea dictumst etiam faucibus cursus urna ut tellus nulla ut erat id mauris vulputate
213,Alameda,Roscow,7.2675115,28.678979,enim in tempor turpis nec euismod scelerisque quam turpis adipiscing lorem vitae mattis nibh ligula nec sem duis aliquam convallis
214,Emelen,Hunstone,54.982808,73.328393,massa volutpat convallis morbi odio odio elementum eu interdum eu tincidunt in leo maecenas pulvinar lobortis est phasellus
215,Chanda,Bettam,2.9667878,32.0837445,pede venenatis non sodales sed tincidunt eu felis fusce posuere felis sed lacus morbi sem mauris laoreet
216,Gertrude,Royston,-12.8490559,45.1394745,sapien ut nunc vestibulum ante ipsum primis in faucibus orci luctus et ultrices posuere cubilia curae mauris viverra diam vitae
217,Tiphanie,Mustoe,29.623319,100.222137,rutrum ac lobortis vel dapibus at diam nam tristique tortor eu pede
218,Denys,Bricksey,3.22059,-76.415465,purus aliquet at feugiat non pretium quis lectus suspendisse potenti in eleifend quam a odio
219,Ambur,Beswick,41.0423985,21.3607894,id justo sit amet sapien dignissim vestibulum vestibulum ante ipsum primis in faucibus orci
220,Raffaello,Bowyer,62.4144225,17.2870792,platea dictumst aliquam augue quam sollicitudin vitae consectetuer eget rutrum at lorem integer tincidunt ante vel ipsum praesent
221,Morley,Cockaday,-3.9997372,-38.4429274,sociis natoque penatibus et magnis dis parturient montes nascetur ridiculus mus etiam vel augue vestibulum rutrum rutrum neque aenean auctor
222,Aurel,Kellick,59.3606836,17.9701456,ultrices posuere cubilia curae nulla dapibus dolor vel est donec odio justo sollicitudin ut suscipit a
223,Cissiee,Lotze,-26.8985232,27.4732571,elementum pellentesque quisque porta volutpat erat quisque erat eros viverra
224,Rica,Boundy,37.429832,110.88907,nunc rhoncus dui vel sem sed sagittis nam congue risus semper porta volutpat quam pede lobortis ligula
225,Winna,Colborn,40.4579077,-7.845845,cubilia curae donec pharetra magna vestibulum aliquet ultrices erat tortor sollicitudin mi sit amet lobortis
226,Justin,Oddie,24.8805556,102.4752778,donec ut mauris eget massa tempor convallis nulla neque libero convallis
227,Sharla,Belfrage,48.890054,2.2372792,mauris ullamcorper purus sit amet nulla quisque arcu libero rutrum ac lobortis vel
228,Silvan,McCathie,13.7946714,5.2527741,erat curabitur gravida nisi at nibh in hac habitasse platea dictumst aliquam augue quam sollicitudin
229,Bill,Katz,-3.4944313,31.9899648,rhoncus aliquam lacus morbi quis tortor id nulla ultrices aliquet maecenas leo odio condimentum id luctus nec molestie
230,Deana,Teml,-34.7235134,-58.7945777,ultrices erat tortor sollicitudin mi sit amet lobortis sapien sapien
231,Heinrick,O'Hannen,9.7016493,-84.1005807,felis sed interdum venenatis turpis enim blandit mi in porttitor pede justo eu massa donec
232,Mirella,Efford,41.9986907,21.4874715,pellentesque ultrices phasellus id sapien in sapien iaculis congue vivamus metus arcu adipiscing
233,Arny,Tytler,-23.7461236,-46.3958816,curae duis faucibus accumsan odio curabitur convallis duis consequat dui nec nisi volutpat
234,Reinaldo,Salzburger,9.9037751,4.4053497,ut odio cras mi pede malesuada in imperdiet et commodo vulputate justo in blandit ultrices enim lorem ipsum
235,Demetra,Shulver,45.8029045,38.9986184,sodales scelerisque mauris sit amet eros suspendisse accumsan tortor quis turpis sed ante vivamus tortor
236,Gabi,Harower,40.9971976,22.5703984,amet sapien dignissim vestibulum vestibulum ante ipsum primis in faucibus orci luctus et ultrices posuere cubilia curae nulla dapibus dolor
237,Sheena,Folbigg,0.965759,31.7195459,est donec odio justo sollicitudin ut suscipit a feugiat et eros vestibulum ac est lacinia nisi venenatis tristique fusce congue
238,Lelia,Impey,38.8905198,-7.5457633,fusce congue diam id ornare imperdiet sapien urna pretium nisl ut volutpat sapien arcu sed augue aliquam
239,Tamas,Quarrell,21.857958,111.982232,aliquet pulvinar sed nisl nunc rhoncus dui vel sem sed sagittis nam congue risus semper porta
240,Rolfe,Duferie,46.3194856,-0.4546217,proin eu mi nulla ac enim in tempor turpis nec euismod scelerisque quam turpis
241,Rickert,Papachristophorou,-20.9096549,-51.3860303,etiam justo etiam pretium iaculis justo in hac habitasse platea dictumst etiam faucibus cursus urna ut tellus
242,Shoshanna,Heffron,35.1002148,-89.8500299,morbi quis tortor id nulla ultrices aliquet maecenas leo odio condimentum id
243,Pam,Petcher,-34.5484605,-58.5717015,aenean auctor gravida sem praesent id massa id nisl venenatis lacinia aenean sit amet justo morbi ut odio
244,Stanton,Zanioletti,27.872028,112.969479,cras non velit nec nisi vulputate nonummy maecenas tincidunt lacus
245,Channa,Sorsby,6.8954177,126.0203934,elementum pellentesque quisque porta volutpat erat quisque erat eros viverra eget congue eget semper rutrum nulla nunc purus phasellus in
246,Bobby,Mont,38.4112661,140.3538627,pellentesque ultrices mattis odio donec vitae nisi nam ultrices libero non mattis
247,Caz,Gumly,29.270311,88.880492,ligula nec sem duis aliquam convallis nunc proin at turpis a pede posuere nonummy integer non velit donec diam neque
248,Lorin,Lawman,52.8769629,17.950135,metus sapien ut nunc vestibulum ante ipsum primis in faucibus orci luctus et ultrices posuere cubilia curae mauris
249,Dorie,Bonnavant,59.2690316,18.0588936,justo nec condimentum neque sapien placerat ante nulla justo aliquam quis turpis eget elit sodales scelerisque mauris sit
250,Elsi,Tarbin,-9.1015826,160.147069,tempor turpis nec euismod scelerisque quam turpis adipiscing lorem vitae mattis nibh ligula nec sem duis aliquam convallis
251,Devlin,Collaton,-8.4734,119.9896,turpis sed ante vivamus tortor duis mattis egestas metus aenean fermentum
252,Cece,Fletcher,22.993423,113.718807,fermentum donec ut mauris eget massa tempor convallis nulla neque libero convallis eget eleifend luctus ultricies eu nibh quisque id
253,Kelcie,Wilsone,-18.9745738,-49.4600885,mauris vulputate elementum nullam varius nulla facilisi cras non velit nec nisi vulputate nonummy maecenas tincidunt lacus
254,Albert,Farmar,19.7899891,-99.6684882,elit proin interdum mauris non ligula pellentesque ultrices phasellus id sapien in sapien iaculis congue vivamus metus arcu
255,Sioux,Lusgdin,37.105382,116.694361,nec nisi volutpat eleifend donec ut dolor morbi vel lectus in quam fringilla rhoncus mauris enim leo rhoncus sed vestibulum
256,Luca,Hussell,13.9803424,-90.2043971,imperdiet et commodo vulputate justo in blandit ultrices enim lorem ipsum
257,Selena,Berkelay,-24.8009137,-65.426487,rhoncus mauris enim leo rhoncus sed vestibulum sit amet cursus
258,Carrol,Heilds,-7.3055997,108.0940566,erat fermentum justo nec condimentum neque sapien placerat ante nulla justo aliquam
259,Pattin,Aspinell,38.9080786,-77.0406147,ut nulla sed accumsan felis ut at dolor quis odio consequat varius integer ac leo pellentesque ultrices mattis odio
260,Ferris,Bahls,-6.4153234,108.3890321,sagittis sapien cum sociis natoque penatibus et magnis dis parturient
261,Brynne,Sharratt,-7.0972,113.6404,quisque porta volutpat erat quisque erat eros viverra eget congue eget
262,Jarred,Simmonett,39.3641607,-7.7461418,augue vestibulum ante ipsum primis in faucibus orci luctus et ultrices posuere cubilia curae donec pharetra magna
263,Rubia,Horder,53.4102363,24.5338655,neque libero convallis eget eleifend luctus ultricies eu nibh quisque id justo sit amet sapien dignissim vestibulum vestibulum
264,Ronnie,MacCaughan,36.07222,14.23583,iaculis diam erat fermentum justo nec condimentum neque sapien placerat ante
265,Jennie,Bearns,40.9369019,44.777047,viverra eget congue eget semper rutrum nulla nunc purus phasellus in felis donec semper sapien a libero nam
266,Zachary,Casley,41.217649,123.1966721,ultrices posuere cubilia curae duis faucibus accumsan odio curabitur convallis duis consequat dui nec nisi volutpat eleifend donec
267,Oralle,Concannon,-8.8025,117.7774,id consequat in consequat ut nulla sed accumsan felis ut at dolor quis odio consequat varius integer ac leo pellentesque
268,Timoteo,Fidian,48.017152,23.572467,felis donec semper sapien a libero nam dui proin leo
269,Claudie,Kinig,23.018033,-82.3343375,eu orci mauris lacinia sapien quis libero nullam sit amet
270,Carlene,Duffell,23.7247599,108.8076195,sed ante vivamus tortor duis mattis egestas metus aenean fermentum donec ut
271,Jewell,Morin,59.3015113,17.9981495,lectus in quam fringilla rhoncus mauris enim leo rhoncus sed vestibulum sit amet cursus id turpis integer aliquet massa
272,Friedrick,Zammett,29.270311,88.880492,morbi porttitor lorem id ligula suspendisse ornare consequat lectus in est risus auctor sed tristique in tempus
273,Thebault,Baudassi,39.930195,114.746256,pede justo lacinia eget tincidunt eget tempus vel pede morbi porttitor lorem id
274,Anthiathia,Pitkethly,-4.0087147,136.0369403,dui luctus rutrum nulla tellus in sagittis dui vel nisl duis ac nibh
275,Stanislaw,Poulston,40.6180185,-8.7338528,sodales scelerisque mauris sit amet eros suspendisse accumsan tortor quis turpis sed ante vivamus
276,Bevin,Comelini,28.260141,112.571923,sapien arcu sed augue aliquam erat volutpat in congue etiam justo
277,Giselbert,Kennealy,7.9187344,125.3297787,amet erat nulla tempus vivamus in felis eu sapien cursus vestibulum
278,Franciskus,Kinze,-6.7728847,110.816549,ultrices posuere cubilia curae donec pharetra magna vestibulum aliquet ultrices erat tortor sollicitudin mi sit amet
279,Jimmy,Dishman,-7.1269261,112.3337769,montes nascetur ridiculus mus vivamus vestibulum sagittis sapien cum sociis natoque penatibus et magnis dis parturient
280,Durant,Kaspar,45.3913779,40.1763516,convallis duis consequat dui nec nisi volutpat eleifend donec ut dolor morbi vel lectus
281,Ashlan,Romer,29.584292,111.380014,condimentum neque sapien placerat ante nulla justo aliquam quis turpis
282,Caren,Delos,47.535711,29.4562298,sodales scelerisque mauris sit amet eros suspendisse accumsan tortor quis turpis sed ante vivamus tortor
283,Lancelot,Ossenna,-2.7129174,102.8917556,potenti in eleifend quam a odio in hac habitasse platea dictumst maecenas ut
284,Anatole,Gringley,46.0765073,-66.7299108,nec euismod scelerisque quam turpis adipiscing lorem vitae mattis nibh ligula nec sem duis aliquam convallis nunc proin
285,Bart,Sauvain,35.4297161,134.3869188,purus phasellus in felis donec semper sapien a libero nam dui
286,Giffer,Walkington,60.2025952,24.904004,donec vitae nisi nam ultrices libero non mattis pulvinar nulla pede ullamcorper augue a suscipit nulla
287,Alisun,Cumesky,2.298952,98.1120116,viverra dapibus nulla suscipit ligula in lacus curabitur at ipsum ac tellus semper interdum mauris ullamcorper purus sit amet nulla
288,Rice,Seage,55.8930684,37.585677,id ornare imperdiet sapien urna pretium nisl ut volutpat sapien arcu sed augue aliquam erat volutpat
289,Maxine,Cadalleder,-31.5720128,28.7649835,est congue elementum in hac habitasse platea dictumst morbi vestibulum velit id pretium iaculis diam erat
290,Reilly,Hickenbottom,15.3483742,-88.3967536,augue luctus tincidunt nulla mollis molestie lorem quisque ut erat curabitur gravida
291,Zack,Fortune,46.524052,41.5008684,ac consequat metus sapien ut nunc vestibulum ante ipsum primis in faucibus orci luctus
292,Lenora,Litchmore,14.3407483,121.0650042,ligula sit amet eleifend pede libero quis orci nullam molestie nibh in
293,Andra,Potier,40.211932,-8.8417565,gravida sem praesent id massa id nisl venenatis lacinia aenean sit amet justo morbi ut
294,Molli,Alyonov,6.9894019,79.8933077,est lacinia nisi venenatis tristique fusce congue diam id ornare imperdiet sapien urna pretium nisl ut volutpat sapien arcu sed
295,Gayelord,Wheatley,50.216501,21.6671416,lorem ipsum dolor sit amet consectetuer adipiscing elit proin interdum mauris non ligula pellentesque ultrices
296,Emmie,Bolt,-30.0319,-70.7081,molestie lorem quisque ut erat curabitur gravida nisi at nibh in hac
297,Rufe,Tollemache,56.6739933,16.2869539,turpis integer aliquet massa id lobortis convallis tortor risus dapibus augue vel
298,Nathaniel,Toquet,59.3625458,17.9989049,ultrices aliquet maecenas leo odio condimentum id luctus nec molestie sed justo pellentesque viverra pede ac diam
299,Aguste,O'Hare,42.5246357,87.5395855,hac habitasse platea dictumst etiam faucibus cursus urna ut tellus nulla ut
300,Lane,Whitsun,22.919228,115.652151,non mauris morbi non lectus aliquam sit amet diam in magna bibendum imperdiet nullam orci
301,Ester,Taffurelli,48.3162239,24.9330262,nulla ac enim in tempor turpis nec euismod scelerisque quam turpis
302,Tiffanie,Prestwich,57.1785037,14.0676645,et commodo vulputate justo in blandit ultrices enim lorem ipsum dolor
303,Aila,Bastiman,7.1962805,125.4078017,amet cursus id turpis integer aliquet massa id lobortis convallis tortor risus dapibus augue vel accumsan tellus
304,Nathalie,Bothwell,29.809116,119.781131,odio porttitor id consequat in consequat ut nulla sed accumsan felis ut at dolor quis odio consequat varius
305,Alis,Clinnick,41.7669671,129.723402,platea dictumst morbi vestibulum velit id pretium iaculis diam erat fermentum justo nec condimentum neque sapien
306,Astrix,Colby,24.3635886,88.6241351,egestas metus aenean fermentum donec ut mauris eget massa tempor convallis nulla neque libero convallis
307,Barnie,Boller,-34.5484605,-58.5717015,primis in faucibus orci luctus et ultrices posuere cubilia curae duis faucibus accumsan odio curabitur convallis duis consequat dui nec
308,Sebastian,Lening,31.7746473,73.5953173,et magnis dis parturient montes nascetur ridiculus mus etiam vel augue vestibulum rutrum rutrum
309,Steve,Coldwell,44.509727,18.0254081,vivamus vestibulum sagittis sapien cum sociis natoque penatibus et magnis dis
310,Roger,Dalston,28.55386,112.35518,ligula vehicula consequat morbi a ipsum integer a nibh in quis justo maecenas rhoncus aliquam
311,Prentiss,Bosworth,19.42998,-99.2130842,rutrum nulla tellus in sagittis dui vel nisl duis ac nibh fusce lacus purus aliquet at feugiat non pretium
312,Dee,Brackenridge,43.7441795,2.511999,fusce lacus purus aliquet at feugiat non pretium quis lectus
313,Otho,Piscopo,9.9578348,124.1789637,penatibus et magnis dis parturient montes nascetur ridiculus mus vivamus vestibulum sagittis sapien cum sociis natoque penatibus et magnis dis
314,Tito,Bourner,41.8499561,-87.650042,eu felis fusce posuere felis sed lacus morbi sem mauris laoreet ut rhoncus aliquet pulvinar sed
315,Ange,Soda,50.1157078,8.6591469,duis consequat dui nec nisi volutpat eleifend donec ut dolor morbi vel lectus in quam fringilla rhoncus
316,Creight,Canaan,39.886547,116.989574,quam sapien varius ut blandit non interdum in ante vestibulum ante ipsum primis in faucibus orci luctus et ultrices posuere
317,Stan,Tschirschky,32.2514545,-110.8374104,auctor gravida sem praesent id massa id nisl venenatis lacinia aenean sit
318,Hubie,Kunneke,-23.1427013,-44.1663455,rhoncus aliquet pulvinar sed nisl nunc rhoncus dui vel sem sed sagittis nam congue risus
319,Alfy,Shirtcliffe,60.5381467,15.427113,quam fringilla rhoncus mauris enim leo rhoncus sed vestibulum sit amet cursus id turpis integer
320,Gayle,Pether,15.4053048,-91.7142051,euismod scelerisque quam turpis adipiscing lorem vitae mattis nibh ligula nec sem
321,Justis,Benns,7.916433,124.200182,nulla neque libero convallis eget eleifend luctus ultricies eu nibh quisque
322,Denyse,Thain,45.1810363,19.9442694,massa id lobortis convallis tortor risus dapibus augue vel accumsan
323,Innis,Rennix,-4.4606478,-65.6658568,tristique fusce congue diam id ornare imperdiet sapien urna pretium
324,Taddeo,Sellwood,30.113962,118.169798,primis in faucibus orci luctus et ultrices posuere cubilia curae donec pharetra magna vestibulum aliquet
325,Flinn,Bonicelli,49.0344853,2.2178783,est congue elementum in hac habitasse platea dictumst morbi vestibulum velit id pretium iaculis diam erat fermentum
326,Nissy,Margiotta,18.5118006,105.2662931,rutrum neque aenean auctor gravida sem praesent id massa id nisl venenatis lacinia aenean sit amet justo morbi
327,Bastian,Geikie,22.817002,108.366543,natoque penatibus et magnis dis parturient montes nascetur ridiculus mus vivamus
328,Con,Rospars,6.9641667,158.2083333,lacinia aenean sit amet justo morbi ut odio cras mi pede malesuada in imperdiet et commodo vulputate justo in blandit
329,Siegfried,Guwer,59.4310564,26.2664249,potenti nullam porttitor lacus at turpis donec posuere metus vitae ipsum aliquam
330,Theresa,Burniston,16.1797497,107.7215969,vulputate ut ultrices vel augue vestibulum ante ipsum primis in faucibus orci
331,Wesley,Lingner,25.0522614,-78.0430817,morbi non lectus aliquam sit amet diam in magna bibendum imperdiet nullam orci
332,Slade,Eddolls,9.9037751,4.4053497,risus dapibus augue vel accumsan tellus nisi eu orci mauris
333,Glad,Carrigan,41.0057729,71.6436028,nunc commodo placerat praesent blandit nam nulla integer pede justo lacinia eget tincidunt
334,Stavro,Giacometti,29.295,47.93306,sed tincidunt eu felis fusce posuere felis sed lacus morbi sem mauris laoreet ut rhoncus aliquet pulvinar sed nisl nunc
335,Magda,Thorndale,33.12688,106.558023,rutrum rutrum neque aenean auctor gravida sem praesent id massa id nisl venenatis lacinia aenean sit
336,Dave,Doughtery,50.480431,121.682569,rutrum neque aenean auctor gravida sem praesent id massa id nisl venenatis lacinia aenean sit amet justo morbi ut
337,Thornton,Frances,25.526437,111.600795,varius nulla facilisi cras non velit nec nisi vulputate nonummy maecenas tincidunt lacus at velit vivamus vel nulla eget eros
338,Otis,Ander,6.470326,12.6187506,libero ut massa volutpat convallis morbi odio odio elementum eu interdum eu tincidunt in leo maecenas pulvinar lobortis
339,Boothe,Hacquel,49.874775,19.628749,rhoncus aliquet pulvinar sed nisl nunc rhoncus dui vel sem sed sagittis nam congue risus
340,Etienne,Leist,51.8614971,50.3456762,sapien ut nunc vestibulum ante ipsum primis in faucibus orci luctus et ultrices posuere cubilia curae mauris viverra diam
341,Atlante,Prescott,51.62883,20.52487,nibh in lectus pellentesque at nulla suspendisse potenti cras in purus
342,Brit,Shillaker,47.5246265,-0.557101,amet turpis elementum ligula vehicula consequat morbi a ipsum integer a nibh in
343,Ab,Reubel,-20.0421785,-47.7563994,vivamus in felis eu sapien cursus vestibulum proin eu mi nulla ac
344,Batsheva,Basden,-34.604369,-58.4838202,nulla elit ac nulla sed vel enim sit amet nunc viverra
345,Phylys,Finicj,35.8941687,-5.2919563,erat quisque erat eros viverra eget congue eget semper rutrum nulla nunc purus phasellus in felis donec semper
346,Arlan,Yearns,46.465362,124.670305,in hac habitasse platea dictumst aliquam augue quam sollicitudin vitae consectetuer eget rutrum at lorem integer
347,Janka,Edmenson,-6.3621916,106.8502879,blandit ultrices enim lorem ipsum dolor sit amet consectetuer adipiscing elit proin interdum
348,Beitris,Sevier,10.9819737,-74.9438915,quis turpis sed ante vivamus tortor duis mattis egestas metus aenean fermentum
349,Dita,Allport,30.8043158,72.2069276,integer a nibh in quis justo maecenas rhoncus aliquam lacus morbi quis tortor id nulla ultrices aliquet maecenas
350,Penelopa,Wrighton,50.4119089,16.5148115,vel enim sit amet nunc viverra dapibus nulla suscipit ligula in lacus curabitur at ipsum ac tellus semper
351,Babb,Tarply,36.886546,121.456161,eget massa tempor convallis nulla neque libero convallis eget eleifend
352,Wylma,Huxter,-6.6906402,-35.5000999,molestie hendrerit at vulputate vitae nisl aenean lectus pellentesque eget nunc donec quis orci eget orci vehicula condimentum curabitur in
353,Marieann,Secker,41.0911538,44.6590356,platea dictumst aliquam augue quam sollicitudin vitae consectetuer eget rutrum
354,Fletch,Sarfatti,-6.5687237,106.6491595,primis in faucibus orci luctus et ultrices posuere cubilia curae duis faucibus accumsan odio curabitur convallis
355,Eugenie,Howe,40.290497,116.574067,nullam sit amet turpis elementum ligula vehicula consequat morbi a ipsum integer
356,Cobb,Hebborne,29.985295,122.207215,ut blandit non interdum in ante vestibulum ante ipsum primis in faucibus orci luctus et ultrices posuere
357,Laughton,Geerdts,-8.5693,116.6242,interdum mauris non ligula pellentesque ultrices phasellus id sapien in sapien iaculis congue vivamus metus arcu
358,Gayler,Menloe,19.638192,-99.079824,consequat nulla nisl nunc nisl duis bibendum felis sed interdum venenatis turpis enim blandit mi in porttitor pede
359,Britte,Plunket,59.4180182,27.5120803,vel nulla eget eros elementum pellentesque quisque porta volutpat erat quisque erat eros viverra
360,Xavier,Menhenitt,-27.01139,-49.5483671,et magnis dis parturient montes nascetur ridiculus mus etiam vel
361,Corissa,Willshire,-16.9214298,49.5853012,et ultrices posuere cubilia curae mauris viverra diam vitae quam suspendisse potenti nullam
362,Suzanne,Ridsdole,2.9363162,97.6385368,elit proin risus praesent lectus vestibulum quam sapien varius ut blandit non interdum in
363,Nelson,Ajean,-6.8897071,-38.5612185,quis odio consequat varius integer ac leo pellentesque ultrices mattis odio donec vitae nisi nam ultrices libero non
364,Arthur,Jeste,40.1063792,20.2318416,faucibus accumsan odio curabitur convallis duis consequat dui nec nisi volutpat eleifend donec ut
365,Kinny,Poyle,3.251528,-76.229027,morbi odio odio elementum eu interdum eu tincidunt in leo maecenas pulvinar
366,Ainsley,Jordine,18.2943776,105.6745247,felis sed interdum venenatis turpis enim blandit mi in porttitor pede justo eu massa donec dapibus duis at velit eu
367,Reed,Dobney,44.1372925,4.810107,in tempor turpis nec euismod scelerisque quam turpis adipiscing lorem vitae mattis nibh ligula nec sem duis aliquam convallis
368,Killie,Mellsop,3.2093353,101.6716295,consequat nulla nisl nunc nisl duis bibendum felis sed interdum venenatis turpis enim blandit mi in porttitor pede
369,Dorian,Bengochea,33.5147935,130.4936331,amet nulla quisque arcu libero rutrum ac lobortis vel dapibus at
370,Casper,Attle,6.9782137,79.9115522,tristique in tempus sit amet sem fusce consequat nulla nisl nunc
371,Tess,Elgey,-6.633688,107.1573142,pretium nisl ut volutpat sapien arcu sed augue aliquam erat volutpat in congue etiam justo etiam pretium iaculis justo in
