id,first_name,last_name,latitute,longitude,words
1,Maritsa,Cossey,39.9474817,116.4689261,enim leo rhoncus sed vestibulum sit amet cursus id turpis integer aliquet massa id lobortis convallis
2,Daria,Jameson,39.8502497,116.2190658,eros suspendisse accumsan tortor quis turpis sed ante vivamus tortor duis mattis egestas metus aenean fermentum donec ut mauris
3,Kristine,Castard,41.866056,-8.4064036,lobortis sapien sapien non mi integer ac neque duis bibendum morbi non quam nec dui luctus rutrum nulla
4,Domingo,Frostdick,22.543096,114.057865,et magnis dis parturient montes nascetur ridiculus mus vivamus vestibulum sagittis sapien cum sociis natoque penatibus et
5,Bianca,Heape,46.8122174,75.0287331,nam nulla integer pede justo lacinia eget tincidunt eget tempus vel pede morbi porttitor
6,Jedediah,Fairbourne,43.4554,43.5944,phasellus in felis donec semper sapien a libero nam dui proin
7,Junina,Trase,49.6076079,20.0926064,pellentesque ultrices mattis odio donec vitae nisi nam ultrices libero non mattis pulvinar nulla pede ullamcorper augue
8,Lavena,Philipson,33.425934,66.5344159,non mi integer ac neque duis bibendum morbi non quam nec dui
9,Nikolai,Mulloch,41.4514619,-8.4873087,vitae quam suspendisse potenti nullam porttitor lacus at turpis donec posuere metus vitae ipsum
10,Cornall,Hailston,31.221597,121.409352,sapien dignissim vestibulum vestibulum ante ipsum primis in faucibus orci luctus et ultrices posuere cubilia curae nulla dapibus
11,Aube,McDavid,18.2480842,120.6207677,neque duis bibendum morbi non quam nec dui luctus rutrum nulla tellus in
12,Daphene,Reinmar,-6.4594857,105.9141793,neque sapien placerat ante nulla justo aliquam quis turpis eget
13,Birgitta,Slot,49.8932232,12.7301543,morbi vel lectus in quam fringilla rhoncus mauris enim leo rhoncus sed vestibulum sit amet cursus id
14,Paolina,Kabos,41.5146956,-8.2971003,ridiculus mus etiam vel augue vestibulum rutrum rutrum neque aenean auctor gravida sem praesent id massa
15,Lowell,Vanni,-6.3870559,-77.5461785,scelerisque mauris sit amet eros suspendisse accumsan tortor quis turpis
16,Bella,Kinrade,37.5392646,127.2148919,quam pharetra magna ac consequat metus sapien ut nunc vestibulum ante
17,Sarina,Stoyle,31.031933,119.659553,aenean auctor gravida sem praesent id massa id nisl venenatis lacinia aenean sit
18,Melosa,Walsh,32.084041,34.887762,risus auctor sed tristique in tempus sit amet sem fusce consequat nulla nisl nunc nisl duis bibendum felis
19,Lilyan,Pettis,37.7451853,-25.5823865,dolor sit amet consectetuer adipiscing elit proin interdum mauris non ligula pellentesque
20,Kylen,Slingsby,49.879152,15.9316109,non pretium quis lectus suspendisse potenti in eleifend quam a odio in hac habitasse platea dictumst maecenas ut massa
21,Steward,Billett,47.797708,5.2787119,natoque penatibus et magnis dis parturient montes nascetur ridiculus mus
22,Lewie,Flori,40.8207633,24.2429692,dolor sit amet consectetuer adipiscing elit proin interdum mauris non ligula pellentesque ultrices phasellus id sapien in
23,Barde,Kristoffersson,45.2497275,19.3967698,justo aliquam quis turpis eget elit sodales scelerisque mauris sit amet eros suspendisse accumsan tortor
24,Margalo,Dolder,23.07555,112.007814,erat volutpat in congue etiam justo etiam pretium iaculis justo in hac habitasse platea dictumst etiam faucibus cursus urna
25,Abbie,Crossgrove,1.2750177,-77.0334179,non ligula pellentesque ultrices phasellus id sapien in sapien iaculis congue vivamus metus
26,Tyrus,Valintine,18.3558066,-99.87075,cursus id turpis integer aliquet massa id lobortis convallis tortor risus dapibus augue vel accumsan tellus nisi eu
27,Charil,Iacovazzi,40.4810579,50.1454455,neque aenean auctor gravida sem praesent id massa id nisl venenatis
28,Wilhelmine,Duigenan,9.5700231,123.312382,congue etiam justo etiam pretium iaculis justo in hac habitasse platea dictumst etiam faucibus cursus urna ut tellus nulla
29,Hewet,Fuzzens,-10.8731945,39.4217212,erat vestibulum sed magna at nunc commodo placerat praesent blandit nam nulla integer pede justo
30,Leonora,Leighton,48.1079676,-1.5212701,volutpat sapien arcu sed augue aliquam erat volutpat in congue etiam justo etiam pretium iaculis justo
31,Fidel,Morfett,30.9127987,121.9104961,eget rutrum at lorem integer tincidunt ante vel ipsum praesent blandit lacinia erat vestibulum sed magna at nunc
32,Faustina,Lipgens,63.5272366,24.6581193,vulputate ut ultrices vel augue vestibulum ante ipsum primis in
33,Berrie,Shorey,40.232604,116.410742,ligula in lacus curabitur at ipsum ac tellus semper interdum mauris
34,Merrilee,Windrus,-8.4635,115.0159,mauris vulputate elementum nullam varius nulla facilisi cras non velit nec nisi vulputate nonummy maecenas tincidunt lacus at velit
35,Corenda,Ceschelli,55.59754,38.47134,consequat in consequat ut nulla sed accumsan felis ut at dolor quis odio consequat varius integer ac leo pellentesque ultrices
36,Nial,Sandwick,5.5300711,-0.4408037,turpis donec posuere metus vitae ipsum aliquam non mauris morbi non lectus aliquam sit amet
37,Averell,Liddall,23.354091,116.681972,orci luctus et ultrices posuere cubilia curae donec pharetra magna vestibulum aliquet ultrices erat tortor sollicitudin mi sit amet lobortis
38,Tuck,Masser,45.396383,4.3258963,quis lectus suspendisse potenti in eleifend quam a odio in hac habitasse platea dictumst
39,Nester,Luxford,43.0926393,0.7978655,nisl venenatis lacinia aenean sit amet justo morbi ut odio
40,Lyda,Videler,44.0527811,6.1717148,lobortis convallis tortor risus dapibus augue vel accumsan tellus nisi eu orci mauris lacinia sapien quis libero nullam sit
41,Ryun,Mosco,49.7149346,28.8363647,sapien ut nunc vestibulum ante ipsum primis in faucibus orci luctus et ultrices posuere cubilia curae mauris viverra diam vitae
42,Herculie,Naptin,39.4596137,-87.3478243,nam dui proin leo odio porttitor id consequat in consequat ut nulla sed accumsan felis ut at dolor
43,Elise,Riguard,-6.562,105.9917,faucibus cursus urna ut tellus nulla ut erat id mauris vulputate elementum nullam varius nulla facilisi cras
44,Sharlene,Crassweller,35.4731712,137.0375112,justo morbi ut odio cras mi pede malesuada in imperdiet et commodo
45,Demetria,Brimilcome,36.2407094,139.1910402,purus phasellus in felis donec semper sapien a libero nam dui proin leo odio porttitor
46,Janine,Gohn,34.620202,112.453926,orci luctus et ultrices posuere cubilia curae duis faucibus accumsan
47,Flory,Gladyer,22.358416,114.128354,elementum in hac habitasse platea dictumst morbi vestibulum velit id pretium
48,Myer,Hallows,6.191677,-73.0169135,dapibus nulla suscipit ligula in lacus curabitur at ipsum ac tellus semper interdum mauris
49,Caldwell,Dangerfield,16.7742464,121.0882915,ipsum primis in faucibus orci luctus et ultrices posuere cubilia curae nulla dapibus dolor vel est donec odio justo sollicitudin
50,Ara,Rafe,43.193399,128.7887591,imperdiet nullam orci pede venenatis non sodales sed tincidunt eu felis fusce posuere felis sed lacus morbi
51,Gussi,Mein,54.7769326,-101.8448368,magna ac consequat metus sapien ut nunc vestibulum ante ipsum primis in faucibus orci luctus et ultrices posuere cubilia curae
52,Meagan,Scolding,39.0327543,-76.5517132,at nibh in hac habitasse platea dictumst aliquam augue quam sollicitudin vitae consectetuer eget rutrum at lorem integer tincidunt
53,Ted,Abrahmovici,34.500554,103.129954,iaculis congue vivamus metus arcu adipiscing molestie hendrerit at vulputate vitae nisl
54,Reese,Earland,26.641315,100.222545,nulla tempus vivamus in felis eu sapien cursus vestibulum proin eu mi nulla ac enim in
55,Dorolisa,MacKay,49.1656853,16.7861155,curae donec pharetra magna vestibulum aliquet ultrices erat tortor sollicitudin
56,Rodolfo,Colvine,47.3559798,123.9215076,erat fermentum justo nec condimentum neque sapien placerat ante nulla justo aliquam quis turpis eget elit sodales scelerisque
57,Ericha,Franzettoini,25.8038312,-100.3027856,et ultrices posuere cubilia curae mauris viverra diam vitae quam suspendisse potenti nullam porttitor lacus at turpis donec posuere metus
58,Marnia,Bartosek,22.588115,-83.2425711,erat fermentum justo nec condimentum neque sapien placerat ante nulla justo aliquam quis turpis eget elit
59,Maggee,Nursey,10.0910494,-61.5252827,vivamus metus arcu adipiscing molestie hendrerit at vulputate vitae nisl aenean lectus pellentesque eget nunc donec quis orci
60,Roth,Dominique,43.8363441,4.3566473,tortor sollicitudin mi sit amet lobortis sapien sapien non mi
61,Anallese,Gibben,22.2678103,114.2360778,mauris laoreet ut rhoncus aliquet pulvinar sed nisl nunc rhoncus dui vel sem sed sagittis nam congue risus
62,Chancey,Westmacott,-8.2012757,112.1012912,id justo sit amet sapien dignissim vestibulum vestibulum ante ipsum primis
63,Redford,De Vile,49.0993758,-1.0793373,ultrices posuere cubilia curae duis faucibus accumsan odio curabitur convallis duis
64,Kettie,Guerreiro,38.0187253,140.1471983,sagittis nam congue risus semper porta volutpat quam pede lobortis ligula sit amet eleifend pede libero quis orci nullam
65,Maureene,Kellert,54.6593,29.2684,vivamus metus arcu adipiscing molestie hendrerit at vulputate vitae nisl aenean lectus pellentesque eget nunc donec quis
66,Addi,Quaif,45.2977605,2.5135985,mollis molestie lorem quisque ut erat curabitur gravida nisi at nibh
67,Cross,Cherrett,44.284636,129.459707,consequat metus sapien ut nunc vestibulum ante ipsum primis in faucibus orci luctus et ultrices posuere cubilia curae
68,Eleanore,Otterwell,42.972096,126.746309,aliquam erat volutpat in congue etiam justo etiam pretium iaculis justo in hac habitasse platea dictumst etiam
69,Arney,Winspire,-34.5906948,-58.4794982,donec posuere metus vitae ipsum aliquam non mauris morbi non lectus aliquam sit amet diam in magna bibendum imperdiet nullam
70,Selestina,Willbond,42.8983715,71.3979891,tincidunt lacus at velit vivamus vel nulla eget eros elementum pellentesque quisque porta volutpat erat quisque erat eros
71,Iorgos,Irvin,-14.91256,-69.874893,mauris eget massa tempor convallis nulla neque libero convallis eget eleifend luctus ultricies eu nibh quisque
72,Corrina,Brislane,35.00394,104.634983,feugiat non pretium quis lectus suspendisse potenti in eleifend quam
73,Adi,Tomczak,4.6096768,101.1064003,tincidunt nulla mollis molestie lorem quisque ut erat curabitur gravida nisi at nibh in hac habitasse platea dictumst aliquam augue
74,Karola,Gornar,33.4316535,131.3529666,quis justo maecenas rhoncus aliquam lacus morbi quis tortor id nulla ultrices aliquet maecenas leo odio condimentum id luctus nec
75,Neale,Campes,43.6746011,3.9826826,cras in purus eu magna vulputate luctus cum sociis natoque penatibus et magnis dis parturient montes nascetur ridiculus mus
76,Zerk,Huddy,51.55683,105.1262,vestibulum sagittis sapien cum sociis natoque penatibus et magnis dis
77,Weidar,Whiteson,14.0654264,100.6473542,nisi eu orci mauris lacinia sapien quis libero nullam sit
78,Cordi,Roland,9.5183617,-6.482318,vel sem sed sagittis nam congue risus semper porta volutpat quam pede lobortis ligula sit amet eleifend
79,Lowell,Dukesbury,48.0323166,25.7230239,vulputate nonummy maecenas tincidunt lacus at velit vivamus vel nulla eget
80,Donnell,Loudwell,39.109563,117.223371,dui proin leo odio porttitor id consequat in consequat ut nulla sed
81,Corabelle,Antoszczyk,3.1523104,101.7178316,vestibulum ante ipsum primis in faucibus orci luctus et ultrices posuere cubilia curae nulla dapibus dolor vel est
82,Ceciley,Brown,51.1672774,18.0050053,adipiscing elit proin interdum mauris non ligula pellentesque ultrices phasellus id sapien in sapien iaculis congue vivamus metus
83,Moise,Hansford,38.9374004,-9.252733,parturient montes nascetur ridiculus mus etiam vel augue vestibulum rutrum rutrum neque aenean
84,Allin,Scopham,59.272573,17.917045,volutpat eleifend donec ut dolor morbi vel lectus in quam fringilla
85,Shem,Daniel,23.138433,113.351326,mollis molestie lorem quisque ut erat curabitur gravida nisi at nibh in hac
86,Raynor,Costen,41.1588991,-8.0638522,nunc nisl duis bibendum felis sed interdum venenatis turpis enim blandit mi in porttitor pede justo
87,Marcelo,Campling,11.8554828,-86.2183907,phasellus sit amet erat nulla tempus vivamus in felis eu sapien cursus vestibulum proin eu mi nulla ac enim in
88,Sander,Bradden,-17.7332512,168.3273245,tempus semper est quam pharetra magna ac consequat metus sapien ut
89,Mira,Demageard,37.751046,-25.670123,non velit nec nisi vulputate nonummy maecenas tincidunt lacus at velit vivamus vel nulla eget eros elementum
90,Harman,Chadwyck,15.9584937,120.2781338,quis odio consequat varius integer ac leo pellentesque ultrices mattis odio donec vitae nisi nam ultrices libero non mattis
91,Lorne,Torrijos,30.720497,120.26727,congue diam id ornare imperdiet sapien urna pretium nisl ut volutpat sapien arcu sed augue aliquam erat volutpat in
92,Andria,Roxbee,57.2490334,16.4322461,id mauris vulputate elementum nullam varius nulla facilisi cras non velit nec nisi vulputate nonummy maecenas tincidunt lacus
93,Juliette,Weal,22.588115,-83.2425711,suscipit nulla elit ac nulla sed vel enim sit amet nunc
94,Alexandra,Marrill,23.7247599,108.8076195,ac leo pellentesque ultrices mattis odio donec vitae nisi nam
95,Drusi,Render,20.0000983,95.5459787,at velit vivamus vel nulla eget eros elementum pellentesque quisque porta volutpat erat quisque erat eros viverra eget congue eget
96,Tracie,McAlroy,24.561134,112.235945,volutpat convallis morbi odio odio elementum eu interdum eu tincidunt in leo maecenas pulvinar
97,Bonni,Jouanot,5.242598,-75.781831,mattis egestas metus aenean fermentum donec ut mauris eget massa tempor convallis nulla neque libero convallis eget eleifend luctus ultricies
98,Sherlock,Arghent,9.5887428,123.7337859,ipsum dolor sit amet consectetuer adipiscing elit proin risus praesent lectus vestibulum quam sapien varius ut
99,Malissia,Larsen,44.9280296,4.8932938,erat vestibulum sed magna at nunc commodo placerat praesent blandit nam nulla integer pede justo
100,Karisa,Isaksen,57.1355803,103.9325393,molestie sed justo pellentesque viverra pede ac diam cras pellentesque volutpat dui
101,Travus,Seymer,-6.5211331,106.8502879,posuere cubilia curae mauris viverra diam vitae quam suspendisse potenti nullam porttitor lacus
102,Merola,Full,-6.427987,110.9561,orci luctus et ultrices posuere cubilia curae donec pharetra magna vestibulum aliquet ultrices erat tortor sollicitudin mi
103,Emlyn,Weale,49.8970603,22.509917,dis parturient montes nascetur ridiculus mus etiam vel augue vestibulum rutrum rutrum neque
104,Mitchel,Gewer,60.9847449,76.4585878,tellus in sagittis dui vel nisl duis ac nibh fusce lacus purus aliquet at feugiat non pretium quis lectus
105,Lola,Meus,55.807167,37.500595,rutrum rutrum neque aenean auctor gravida sem praesent id massa id nisl venenatis
106,Ingmar,Lafond,44.9468994,-92.9105987,lacus morbi sem mauris laoreet ut rhoncus aliquet pulvinar sed nisl nunc rhoncus dui vel sem sed sagittis nam
107,Abby,Cutriss,-6.90572,109.01489,vestibulum eget vulputate ut ultrices vel augue vestibulum ante ipsum primis in
108,Braden,Banbrigge,39.732646,112.040028,convallis nunc proin at turpis a pede posuere nonummy integer non velit donec diam
109,Ezechiel,Dibbe,29.4315861,106.912251,hac habitasse platea dictumst aliquam augue quam sollicitudin vitae consectetuer eget rutrum
110,Annamaria,Inglesant,-8.1500032,112.3695412,donec vitae nisi nam ultrices libero non mattis pulvinar nulla pede ullamcorper augue a suscipit nulla elit ac nulla
111,Demeter,Parkins,52.2627273,-8.2755058,lectus aliquam sit amet diam in magna bibendum imperdiet nullam orci pede venenatis non sodales
112,Sander,Fawloe,40.1420033,-82.9770371,curabitur convallis duis consequat dui nec nisi volutpat eleifend donec ut dolor morbi vel lectus in quam fringilla rhoncus mauris
113,Ansley,Gambell,27.4583303,120.3078508,massa quis augue luctus tincidunt nulla mollis molestie lorem quisque ut erat curabitur gravida nisi at nibh in hac habitasse
114,Verna,Drayton,53.5380522,17.2364118,elementum pellentesque quisque porta volutpat erat quisque erat eros viverra eget congue eget semper rutrum nulla nunc
115,Anatollo,Dorie,56.4428126,59.129251,nunc vestibulum ante ipsum primis in faucibus orci luctus et ultrices posuere cubilia curae
116,Katleen,Aulton,53.9024585,17.9194558,curabitur at ipsum ac tellus semper interdum mauris ullamcorper purus sit amet nulla quisque arcu libero
117,Rose,Penswick,-9.548008,-76.66935,vestibulum sed magna at nunc commodo placerat praesent blandit nam nulla integer pede justo lacinia eget tincidunt eget
118,Ephrem,Trewhella,14.299475,-88.1706047,integer ac neque duis bibendum morbi non quam nec dui luctus rutrum nulla tellus
119,Kelcey,Lauthian,32.9901655,130.608934,tellus nulla ut erat id mauris vulputate elementum nullam varius nulla facilisi cras
120,Sisile,Caff,14.5302201,100.9192009,nulla mollis molestie lorem quisque ut erat curabitur gravida nisi at nibh in
121,Lew,Stourton,-22.7561319,-43.4607419,cursus id turpis integer aliquet massa id lobortis convallis tortor risus
122,Karie,Pauleit,36.1678611,-115.0406679,sed accumsan felis ut at dolor quis odio consequat varius integer ac leo
123,Evelin,Leishman,40.7760704,44.5477905,sapien placerat ante nulla justo aliquam quis turpis eget elit sodales
124,Gray,Linggood,-7.01771,109.5463954,laoreet ut rhoncus aliquet pulvinar sed nisl nunc rhoncus dui vel sem
125,Tod,Casel,41.403128,119.64328,consequat ut nulla sed accumsan felis ut at dolor quis odio consequat varius integer ac leo pellentesque ultrices mattis
126,Gale,Whitsun,-8.401854,114.118103,imperdiet nullam orci pede venenatis non sodales sed tincidunt eu felis fusce posuere felis
127,Friedrich,Rootes,-17.0127475,48.571263,urna pretium nisl ut volutpat sapien arcu sed augue aliquam erat
128,Raphaela,Mc Meekan,14.1313261,122.8277624,cursus vestibulum proin eu mi nulla ac enim in tempor turpis nec euismod scelerisque quam turpis adipiscing lorem vitae mattis
129,Dorolisa,Brickett,-8.5261,121.9715,maecenas tristique est et tempus semper est quam pharetra magna ac consequat
130,Guthrey,Cornelisse,38.8062871,139.9346659,consectetuer eget rutrum at lorem integer tincidunt ante vel ipsum praesent blandit lacinia
131,Lilllie,Middleweek,28.373163,116.079637,in lacus curabitur at ipsum ac tellus semper interdum mauris ullamcorper purus sit amet nulla quisque
132,Burr,Hubane,30.63166,114.040353,eros elementum pellentesque quisque porta volutpat erat quisque erat eros viverra eget congue eget
133,Giustino,Sterre,40.9369019,44.777047,pede venenatis non sodales sed tincidunt eu felis fusce posuere felis sed lacus morbi sem mauris laoreet ut rhoncus
134,Nichol,Angelini,64.918515,16.2948002,ac est lacinia nisi venenatis tristique fusce congue diam id ornare imperdiet sapien urna
135,Daile,Vanne,32.1957948,48.254283,ante ipsum primis in faucibus orci luctus et ultrices posuere cubilia curae nulla dapibus dolor vel est
136,Perry,Woolpert,55.9129296,13.1018168,mollis molestie lorem quisque ut erat curabitur gravida nisi at nibh
137,Bruis,Skelington,46.975033,31.9945829,lobortis sapien sapien non mi integer ac neque duis bibendum morbi non quam nec dui luctus rutrum nulla tellus
138,Merell,Stenton,9.8045793,125.4425344,fermentum justo nec condimentum neque sapien placerat ante nulla justo aliquam quis turpis eget elit sodales scelerisque mauris sit
139,Gamaliel,Biasio,41.1694718,75.8098141,justo maecenas rhoncus aliquam lacus morbi quis tortor id nulla ultrices aliquet maecenas
140,Lavena,Jirieck,48.3000957,39.7430006,varius integer ac leo pellentesque ultrices mattis odio donec vitae nisi nam ultrices libero non mattis
141,Lorena,Spinozzi,-1.4391409,-46.3624686,dis parturient montes nascetur ridiculus mus etiam vel augue vestibulum rutrum rutrum neque aenean auctor gravida sem
142,Sal,Masding,27.69965,108.839557,eu interdum eu tincidunt in leo maecenas pulvinar lobortis est phasellus sit amet erat nulla tempus vivamus
143,Ransom,Pounsett,40.7388893,43.9061272,tincidunt in leo maecenas pulvinar lobortis est phasellus sit amet
144,Amos,Giggie,43.2934614,44.0309924,ac consequat metus sapien ut nunc vestibulum ante ipsum primis in faucibus orci luctus
145,Kalvin,Eim,53.42049,16.81504,porttitor lorem id ligula suspendisse ornare consequat lectus in est risus auctor
146,Donalt,Swettenham,40.400903,116.771211,amet consectetuer adipiscing elit proin risus praesent lectus vestibulum quam sapien varius ut blandit
147,Kermit,Kissell,24.776827,106.556519,sit amet diam in magna bibendum imperdiet nullam orci pede venenatis non sodales
148,Ninette,Kubyszek,30.600064,114.309091,interdum eu tincidunt in leo maecenas pulvinar lobortis est phasellus sit amet erat
149,Dalia,Baistow,46.426574,14.0833019,in lacus curabitur at ipsum ac tellus semper interdum mauris ullamcorper purus sit amet nulla quisque arcu libero rutrum
150,Trev,Poli,49.4289115,23.7472952,morbi vel lectus in quam fringilla rhoncus mauris enim leo rhoncus sed vestibulum sit amet cursus id
151,Margie,Cotterrill,40.657978,109.840313,at nulla suspendisse potenti cras in purus eu magna vulputate luctus
152,Thorvald,Swanne,42.4423768,-8.6463086,at lorem integer tincidunt ante vel ipsum praesent blandit lacinia
153,Ellwood,Dick,34.6816856,126.9069278,sed tincidunt eu felis fusce posuere felis sed lacus morbi sem mauris laoreet ut rhoncus aliquet pulvinar sed nisl
154,Pebrook,McClancy,34.75,10.78333,donec odio justo sollicitudin ut suscipit a feugiat et eros vestibulum ac est lacinia nisi venenatis
155,Kendall,Sapauton,-27.8846801,25.1533426,odio consequat varius integer ac leo pellentesque ultrices mattis odio donec vitae nisi nam
156,Angeli,Melburg,59.9026039,10.767309,arcu sed augue aliquam erat volutpat in congue etiam justo etiam pretium iaculis
157,Camile,Raithbie,-6.55307,106.27124,pellentesque ultrices phasellus id sapien in sapien iaculis congue vivamus metus arcu adipiscing molestie hendrerit at vulputate vitae
158,Barry,Bean,57.8948,55.9378,tempor convallis nulla neque libero convallis eget eleifend luctus ultricies eu nibh quisque id justo sit
159,Bernetta,Dogerty,49.2066705,2.0391896,nullam molestie nibh in lectus pellentesque at nulla suspendisse potenti cras in purus eu magna vulputate
160,Con,Petheridge,41.8038684,140.7289269,eget orci vehicula condimentum curabitur in libero ut massa volutpat convallis morbi odio odio elementum
161,Lorette,McLese,56.7481754,61.3755425,habitasse platea dictumst maecenas ut massa quis augue luctus tincidunt nulla mollis molestie lorem quisque ut erat curabitur
162,Rodrique,La Wille,-20.0877391,-51.0966063,pretium iaculis justo in hac habitasse platea dictumst etiam faucibus cursus
163,Libbie,Manske,41.11028,21.01139,in congue etiam justo etiam pretium iaculis justo in hac habitasse platea dictumst etiam faucibus cursus urna
164,Cameron,Shimon,29.531057,112.540463,vitae quam suspendisse potenti nullam porttitor lacus at turpis donec posuere metus vitae ipsum aliquam non
165,Morganica,Demougeot,46.562247,125.1353261,nibh ligula nec sem duis aliquam convallis nunc proin at turpis a pede posuere nonummy integer non velit
166,Gisella,MacPhee,32.082978,35.364579,in felis eu sapien cursus vestibulum proin eu mi nulla ac enim in tempor
167,Halsy,Laux,24.0993614,115.2778465,gravida nisi at nibh in hac habitasse platea dictumst aliquam augue quam sollicitudin vitae consectetuer eget rutrum at
168,Renelle,Felix,-22.0077937,-51.5531899,ut erat curabitur gravida nisi at nibh in hac habitasse platea dictumst aliquam augue quam sollicitudin vitae consectetuer eget rutrum
169,Anabelle,Paddingdon,19.150464,100.0359661,a libero nam dui proin leo odio porttitor id consequat in
170,Tamma,Bartke,54.1,23.7,eleifend pede libero quis orci nullam molestie nibh in lectus pellentesque at
171,Paddie,Keble,48.8120404,2.2718631,in porttitor pede justo eu massa donec dapibus duis at velit eu est congue elementum in hac habitasse platea dictumst
172,Henka,Culvey,14.4223149,-16.702825,fusce lacus purus aliquet at feugiat non pretium quis lectus suspendisse potenti in eleifend
173,Fannie,Bearns,-7.1293143,111.7033357,tellus in sagittis dui vel nisl duis ac nibh fusce
174,Zita,Grisenthwaite,23.36225,103.374576,primis in faucibus orci luctus et ultrices posuere cubilia curae mauris viverra diam vitae quam suspendisse potenti nullam porttitor lacus
175,Garry,Tremaine,8.0882791,-63.5535552,donec pharetra magna vestibulum aliquet ultrices erat tortor sollicitudin mi sit amet lobortis sapien sapien non mi integer
176,Herta,Grimble,-29.8524975,-51.1845782,purus phasellus in felis donec semper sapien a libero nam dui proin leo odio porttitor id
177,Rosemarie,Heningam,-6.8939065,109.6386363,massa id lobortis convallis tortor risus dapibus augue vel accumsan tellus
178,Lyssa,Boeter,40.4970602,22.8338979,interdum eu tincidunt in leo maecenas pulvinar lobortis est phasellus sit amet erat nulla
179,Lovell,Poletto,-8.4358333,119.9916667,libero quis orci nullam molestie nibh in lectus pellentesque at nulla suspendisse potenti cras in purus eu magna
180,Christi,Corbould,-23.8182859,-46.0851681,ipsum ac tellus semper interdum mauris ullamcorper purus sit amet nulla quisque arcu libero rutrum ac lobortis vel
181,Shawn,Libbis,-4.423943,11.69283,dolor vel est donec odio justo sollicitudin ut suscipit a feugiat et eros
182,Davy,Hallas,21.377246,110.250123,accumsan tellus nisi eu orci mauris lacinia sapien quis libero nullam sit amet
183,Lanae,Howison,32.2746515,35.8960765,molestie lorem quisque ut erat curabitur gravida nisi at nibh in hac habitasse platea dictumst aliquam augue
184,Mord,Baudino,24.347324,102.527197,sodales scelerisque mauris sit amet eros suspendisse accumsan tortor quis turpis sed ante vivamus
185,Diane,Gauvain,32.874735,117.531622,dolor sit amet consectetuer adipiscing elit proin risus praesent lectus vestibulum quam sapien varius ut blandit non interdum
